review_id,review_title,review_content
"R3HXWT0LRP0NMF,R2AJM3LFTLZHFO,R6AQJGUP6P86,R1KD19VHEDV0OR,R3C02RMYQMK6FC,R39GQRVBUZBWGY,R2K9EDOE15QIRJ,R3OI7YT648TL8I","Satisfied,Charging is really fast,Value for money,Product review,Good quality,Good product,Good Product,As of now seems good","Looks durable Charging is fine tooNo complains,Charging is really fast, good product.,Till now satisfied with the quality.,This is a good product . The charging speed is slower than the original iPhone cable,Good quality, would recommend,https://m.media-amazon.com/images/W/WEBP_402378-T1/images/I/81---F1ZgHL._SY88.jpg,Product had worked well till date and was having no issue.Cable is also sturdy enough...Have asked for replacement and company is doing the same...,Value for money"
"RGIQEG07R9HS2,R1SMWZQ86XIN8U,R2J3Y1WL29GWDE,RYGGS0M09S3KY,R17KQRUTAN5DKS,R3AAQGS6HP2QUK,R1HDNOG6TO2CCA,R3PHKXYA5AFEOU","A Good Braided Cable for Your Type C Device,Good quality product from ambrane,Super cable,As,Good quality,Good product,its good,Good quality for the price but one issue with my unit","I ordered this cable to connect my phone to Android Auto of car. The cable is really strong and the connection ports are really well made. I already has a Micro USB cable from Ambrane and it's still in good shape. I connected my phone to the car using the cable and it got connected well and no issues. I also connected it to the charging port and yes it has Fast Charging support.,It quality is good at this price and the main thing is that i didn't ever thought that this cable will be so long it's good one and charging power is too good and also supports fast charging,Value for money, with extra length👍,Good, working fine,Product quality is good,Good,very good,Bought for my daughter's old phone.Brand new cable it was not charging, I already repacked and requested for replacement.I checked again, and there was some green colour paste/fungus inside the micro USB connector. I cleaned with an alcoholic and starts working again.Checked the ampere of charging speed got around 1400ma-1500ma - not bad, came with braided 1.5m long cable, pretty impressive for the price.Can't blame the manufacturer.But quality issues by the distributor, they might have stored in very humid place."
"R3J3EQQ9TZI5ZJ,R3E7WBGK7ID0KV,RWU79XKQ6I1QF,R25X4TBMPY91LX,R27OK7G99VK0TR,R207CYDCHJJTCJ,R3PCU8XMU173BT,R1IMONDOWRNU5V","Good speed for earlier versions,Good Product,Working good,Good for the price,Good,Worth for money,Working nice,it's a really nice product","Not quite durable and sturdy,https://m.media-amazon.com/images/W/WEBP_402378-T1/images/I/71rIggrbUCL._SY88.jpg,Working good,https://m.media-amazon.com/images/W/WEBP_402378-T1/images/I/61bKp9YO6wL._SY88.jpg,Product,Very nice product,Working well,It's a really nice product"
"R3EEUZKKK9J36I,R3HJVYCLYOY554,REDECAZ7AMPQC,R1CLH2ULIVG5U3,R2DMKIBGFKBD6R,RC89B5IAJUTR5,R3B3DDON5FH8DS,R13WAEJDI5RS36","Good product,Good one,Nice,Really nice product,Very first time change,Good,Fine product but could be better,Very nice it's charging like jet","Good product,long wire,Charges good,Nice,I bought this cable for Rs.339 worthy product for this price, i tested it in various charger adapters 33w and 18w it supports fast charging as well.,Good,Ok,I had got this at good price on sale on Amazon and product is useful with warranty but for warranty you need to go very far not practical for such a cost and mine micro to type c connector stopped working after few days only.,I like this product"
"R7S8ANNSDPR40,R3CLZFLHVJU26P,RFF7U7MPQFUGR,R1MV1NKC23DWPI,R11D3U0V2XKDKF,R18MP1KLUE18PC,RWGJNVEH5ZQME,R1XN72FU6Q37IH","It's pretty good,Average quality,very good and useful usb cable,Good USB cable. My experience was very good it is long lasting,Good,Nice product and useful,-,Sturdy but does not support 33w charging","It's a good product.,Like,Very good item strong and useful USB cableValue for moneyThanks to amazon and producer,https://m.media-amazon.com/images/I/51112ZRE-1L._SY88.jpg,Good,Nice product and useful product,-,Sturdy but does not support 33w charging"
"R8E73K2KWJRDS,RSD0JTIIWQQL8,R64CRSTE9SLW1,R2FRTNIIUFJE1F,RWGNX3W7UOJ7W,R32TYHHODHTF5D,RQL9ZMQUTY7P2,R280XJ5VZUBOXV","Long durable.,good,Does not charge Lenovo m8 tab,Best charging cable,good,Boat,Product was good,1.5 m का केबल मेरे लिए बहुत ही लाभदायक है ।","Build quality is good and it is comes with 2 year warranty.,Good Product,Bought it for charging my mobile & tab but it doesn't work for Lenovo m8 tab,Guys this cable is is best compare of everyone over heat protection, quickly charging, but chance to shock circuit,good,Nice,Good quality,1.5एम का डाटा केबल मेरे लिए बहुत ही लाभदायक है ।  मैं इस केबल को लाइन में चार्ज करते समय फोन बहुत आराम से उपयोग  कर पा रहा हु । आप इस केबल से 15watt का  चार्जर उसे कर सकते है (इससे जड़ा नही) । लोकल बाजार में इसका दाम 150 है ,  अमेजन पे ये केबल मुझे 67 में मिला । गर्व से कहो हम हिंदू है , जय हिंद जय भारत ,"
"R2X090D1YHACKR,R32ZCIH9AFNJ60,R3N57EVVG0EHAF,R3QWLE8JHROKC1,R2VTSDOOUTSQ5X,R3E6FZ75Q074KH,R1SYBQLTPFCW20,RYQT96J8HPIXE","Worth for money - suitable for Android auto,Good Product,Length,Nice,Original,Very good quay Cable support fast charging.,Original MI cable for charging upto 33 watt,I am veri happy with this product as it provide turbo charging.","Worth for money - suitable for Android auto... my purpose served in car....got it for Rs.150,Everything is Okay. But packaging is not good feeling like seller gave is used cable.,Good product,Good product but cost is more.,Original cable,I bought this cable at 129. Using this cable for Android auto in my car. Perfectly works without any glitch.,Original MI cable. Will charge upto 33 watts. Got it for Rs 150.  I have 67 watt charger and I want a cable for my car so I went for it. I checked the performance with battery charging app. The charging speed is exactly half of my 67 watt original cable. Go for it.,It provided me turbo charging. I recommend for all Redmi note 10s mobile phones. As it provide turbo charging. I am veri happy with this product."
"R11MQS7WD9C3I0,R2AKH69XQY8BY4,R8GBOLYUN5UP6,R1AYVO4R25KJTA,R1HT6XM787V7FV,R339XJL1GMKHA3,R175VFSB2A32HG,R35T9LXYBSP09G","Good for fast charge but not for data transfer,Good cable compares to local the brand.,good but doesnt last,Good product,Good Product,Good and worth it,very good material quality charging speed is 15 watt,Not a fast charger","The cable is efficient in fast charging but in quick data transfer. Overall fine.,I like the usb c  L shape. Nylon Shielded core wire it improves the life of the cable.,i think i buy these every 6 months or so. fast charging stops working after a while. probbly something to do with the cable design. the cable gets twisted over time and I suspect that breaks the high capacity wires inside. but i keep buying it because there arent too many options in an L shaped design,Good and durable product. Sometime the charges doesn't work on few adapters. there might be few cut off or something but works fine on apple adapter, Car charger, USB,The product is really good at affordable price.,Good and fast charging, and value for money,பொருள் உடைய கடினத்தன்மையின் நன்றாக உள்ளது சார்ஜ் ஏறும் வேகம் 15wat,Not a fast charger.  Very slow charging with 65w.  L-shape pin is very useful."
"R1FKOKZ3HHKJBZ,R2WNMZI1EXTA0H,RCA1M3W4RIXUR,R3BKCLL6D7ZLIX,REVSR0ILY3547,R15W5KMQB95IV5,R10PB68FRUHT5V,R3TLCE9JSBU3UP","It's quite good and value for money,Works well,Hdmi cable,Value for money,All good,Gets the job done,Delivery was good,This one was my need to purchase","I am using it for 14 days now. The experience is pretty good as of now. Picture quality is also not bad. Don't expect something out of the world at this price point. But you can go for it if you have a tight budget.,Initial impressions: works as said, glad I didn’t go for cheaper options (not that it’s too costly) just plug and play. Will update if it screws up,The hdmi cable is good to watch movie,sports and its gives better quality while connecting your laptop with TV and play 🎮.I loved it,Works as expected. Length of the cable is short and it was mentioned also satisfied my requirement. If you need more length better look other options.,All good,It's the best HDMI cable at this price range. No problems yet. Just go for it !!,I was expecting this to be delivered on time and it was delivered on time.Product is good as i have tried other cables and wires from Amazon basica brand.,Good one"